{
  "parsedRecordId" : "c9db5d7a-e1d4-11e8-9f32-f2801f1b9fd1",
  "parsedRecordDtoId" : "c56b70ce-4ef6-47ef-8bc3-c470bafa0b8c",
  "suppressDiscovery" : false,
  "instanceId" : "b9a5f035-de63-4e2c-92c2-07240c89b817",
  "leader" : "00047caa\\a2200361\\\\\\4500",
  "fields" : [ {
    "tag" : "007",
    "content" : {
      "Secondary support material" : "g",
      "Base of emulsion" : "c",
      "Category" : "g",
      "Color" : "b",
      "Dimensions" : "f",
      "Sound on medium or separate" : "d",
      "SMD" : "a",
      "Medium for sound" : "e"
    },
    "indicators" : [ ]
  } ],
  "updateInfo" : {
    "recordState" : "ACTUAL",
    "updateDate" : "2020-07-16T15:13:36.879+0300"
  }
}
