{
  "parsedRecordId": "c9db5d7a-e1d4-11e8-9f32-f2801f1b9fd1",
  "parsedRecordDtoId": "c56b70ce-4ef6-47ef-8bc3-c470bafa0b8c",
  "instanceId": "b9a5f035-de63-4e2c-92c2-07240c89b817",
  "suppressDiscovery": false,
  "leader": "00052caa\\a2200361\\\\\\4500",
  "fields": [
    {
      "tag": "007",
      "content": {
        "Category": "c",
        "SMD": "a",
        "Color": "b",
        "Sound": "d",
        "Image bit depth": "efg",
        "File formats": "h",
        "Antecedent/ Source": "j",
        "Level of compression": "k",
        "Reformatting quality": "l"
      },
      "indicators": []
    }
  ]
}
